{
  "$schema": "https://json-schema.org/draft/2020-12/schema",
  "$id": "https://volmit.com/gloss/motion.schema.json",
  "title": "Gloss Motion Document",
  "description": "A keyframe clip applied to rig bones or to a hologram as bone root.",
  "type": "object",
  "required": [
    "schemaVersion",
    "revision",
    "tracks"
  ],
  "properties": {
    "schemaVersion": {
      "description": "Document format revision. Always 1 for motion documents.",
      "type": "integer",
      "const": 1
    },
    "revision": {
      "description": "Server-owned monotonic revision, raised on every save.",
      "type": "integer",
      "minimum": 1,
      "maximum": 9007199254740991
    },
    "durationTicks": {
      "description": "Clip length in ticks. Omitted takes the last keyframe tick.",
      "type": "number",
      "minimum": 0,
      "maximum": 1000000
    },
    "loop": {
      "description": "Playback mode after the clip ends.",
      "type": "string",
      "enum": [
        "once",
        "loop",
        "pingpong"
      ],
      "default": "loop"
    },
    "fps": {
      "description": "Frame rate this clip streams at, clamped by the rigs module maxMotionFps.",
      "type": "integer",
      "minimum": 1,
      "maximum": 120,
      "default": 20
    },
    "tracks": {
      "description": "Channel tracks evaluated for every frame.",
      "type": "array",
      "minItems": 1,
      "maxItems": 256,
      "items": {
        "$ref": "#/$defs/track"
      }
    }
  },
  "$defs": {
    "track": {
      "title": "Motion Track",
      "description": "One channel on one bone.",
      "type": "object",
      "required": [
        "channel",
        "keyframes"
      ],
      "properties": {
        "bone": {
          "description": "Bone id, or * for every bone. Holograms use root.",
          "type": "string",
          "minLength": 1,
          "default": "root"
        },
        "channel": {
          "description": "Animated channel. Rotations are degrees, glow is #AARRGGBB, visible is a boolean.",
          "type": "string",
          "enum": [
            "translation.x",
            "translation.y",
            "translation.z",
            "rotation.x",
            "rotation.y",
            "rotation.z",
            "scale.x",
            "scale.y",
            "scale.z",
            "glow",
            "visible",
            "opacity",
            "brightness"
          ]
        },
        "blend": {
          "description": "How this track combines with the bone rest pose. Defaults per channel: add for translation and rotation, multiply for scale, replace for the rest.",
          "type": "string",
          "enum": [
            "add",
            "multiply",
            "replace"
          ]
        },
        "keyframes": {
          "description": "Keyframes in tick order.",
          "type": "array",
          "minItems": 1,
          "items": {
            "$ref": "#/$defs/keyframe"
          }
        }
      }
    },
    "keyframe": {
      "title": "Motion Keyframe",
      "description": "One value at one tick.",
      "type": "object",
      "required": [
        "tick",
        "value"
      ],
      "properties": {
        "tick": {
          "description": "Tick offset from the clip start.",
          "type": "number",
          "minimum": 0
        },
        "value": {
          "description": "Number for numeric channels, #AARRGGBB string for glow, boolean for visible.",
          "type": [
            "number",
            "string",
            "boolean"
          ]
        },
        "easing": {
          "description": "Curve from this keyframe to the next: linear, hold, ease_in, ease_out, ease_in_out, back_out or bezier(x1,y1,x2,y2).",
          "type": "string",
          "pattern": "^(linear|hold|ease_in|ease_out|ease_in_out|back_out|bezier\\([^)]*\\))$"
        }
      }
    }
  }
}
