{
  "schemaVersion": 1,
  "revision": 1,
  "durationTicks": 40,
  "loop": "pingpong",
  "fps": 30,
  "tracks": [
    {
      "bone": "root",
      "channel": "translation.y",
      "blend": "add",
      "keyframes": [
        { "tick": 0, "value": 0, "easing": "ease_in_out" },
        { "tick": 40, "value": 0.15, "easing": "ease_in_out" }
      ]
    },
    {
      "bone": "root",
      "channel": "scale.y",
      "blend": "multiply",
      "keyframes": [
        { "tick": 0, "value": 1 },
        { "tick": 40, "value": 1.04, "easing": "ease_in_out" }
      ]
    }
  ]
}
