{
  "schemaVersion": 1,
  "revision": 1,
  "durationTicks": 80,
  "loop": "loop",
  "fps": 30,
  "tracks": [
    {
      "bone": "root",
      "channel": "rotation.y",
      "blend": "add",
      "keyframes": [
        { "tick": 0, "value": 0 },
        { "tick": 80, "value": 360 }
      ]
    }
  ]
}
